{
  "marketplace_name": "eval4-fixture-marketplace",
  "plugins": [
    {
      "compatibility": {},
      "created_on": null,
      "domains": [],
      "functional_role": null,
      "id": "plugin_803e5fb4",
      "name": "demo-plugin",
      "naming_history": [
        {
          "evidence": [
            "hypothetical test scenario for eval-4 (marketplace-inventory repair-history)"
          ],
          "name": "demo-plugin-old-name",
          "reason": "Original name at plugin creation, before being renamed to demo-plugin on the same day it was first inventoried. Backfilled historical period missed at bootstrap.",
          "valid_from": "2026-08-26",
          "valid_to": "2026-08-29"
        },
        {
          "evidence": [
            ".claude-plugin/marketplace.json"
          ],
          "name": "demo-plugin",
          "reason": "Current name at inventory bootstrap.",
          "valid_from": "2026-08-29",
          "valid_to": null
        }
      ],
      "provenance": {},
      "score": null,
      "scoring_history": [],
      "security_score": null,
      "security_scoring_history": [],
      "source": "./plugins/demo-plugin",
      "status": "active",
      "status_history": [
        {
          "evidence": [
            ".claude-plugin/marketplace.json"
          ],
          "reason": "Discovered by marketplace-inventory Build/Plan.",
          "status": "active",
          "valid_from": "2026-08-29",
          "valid_to": null
        }
      ]
    }
  ],
  "schema_version": "1.0.0",
  "updated_on": "2026-08-29"
}
